<?xml version="1.0" encoding="UTF-8"?>

<!-- PLEASE READ =========== This search def is for cost forecast variance 
	search tied to the Workflow Cost Forecast Variance Report -->

<SearchFormDefinition
	name="SearchDefCostForecastVarianceReport"
	xmlns:xsi="http://www.w3.org/2001/XMLSchema-instance"
	xsi:noNamespaceSchemaLocation="SearchDefSchema.xsd">
	<Source>
		select fg, pfg
		from FunctionalGroup fg
		left join fg.parentFunctionalGroup pfg
		full join fg.functionalGroupItems im
	</Source>

	<!-- Filter expressions are fixed and not used by the criteria displayed 
		to users They are used to construct fixed criteria based on if the named 
		parameter is present in the list of parameter values passed to the query 
		execution -->
	<Filters>
		<FilterExpression name="cfgTypeFilter" type="FIXED">fg.type = 'CFG'</FilterExpression>
		<FilterExpression name="itemTypeFilter" type="FIXED">(upper(im.itemType) not in ('CFG','PI') or im.itemType is null)</FilterExpression>
		<FilterExpression name="isDeleted" type="FIXED">im.isDeleted != 'Y'</FilterExpression>
	</Filters>

	<SearchParameters>
		<Text name="parentName" matchType="ILIKE"
			labelKey="functionalGroup.parentName"
			finderName="ParentFunctionalGroupName">
			<Expression>lower(pfg.name) like lower(:parentName)</Expression>
		</Text>
		<MultiText name="parentGroupNames" matchType="IEXACT"
			labelKey="functionalGroup.multipleParentGroupNames" rows="3"
			popupFinderName="ParentGroupFinder">
			<Expression>lower(pfg.name) in (:parentGroupNames)</Expression>
		</MultiText>
		<Text name="functionalGroupName" matchType="ILIKE"
			labelKey="functionalGroup.functionalGroupName"
			finderName="FunctionalGroupName">
			<Expression>lower(fg.name) like lower(:functionalGroupName)</Expression>
		</Text>
		<MultiText name="functionalGroupNames" matchType="IEXACT"
			labelKey="tam.exception.multiple_fg" rows="3"
			popupFinderName="FunctionalGroupFinder">
			<Expression>lower(fg.name) in (:functionalGroupNames)</Expression>
		</MultiText>
		<Text name="itemNumber" matchType="ILIKE"
			labelKey="item.itemNumber" finderName="ItemNumber">
			<Expression>lower(im.itemNumber) like lower(:itemNumber)</Expression>
		</Text>
		<MultiText name="itemNumbers" matchType="IEXACT"
			labelKey="item.multipleItemNumbers" rows="3">
			<Expression>lower(im.itemNumber) in (:itemNumbers)</Expression>
		</MultiText>
		<List name="actionDateGE" multiSelect="false"
			labelKey="cost.forecast.validation.report.date" required="false"
			initializer="com.scplatform.pcm.searchframework.initializer.FiscalMonthListInitializer">
			<Expression></Expression>
		</List>
		<List name="region" multiSelect="true" labelKey="tam.region" required="true"
			initializer="com.scplatform.pcm.searchframework.initializer.ForecastRegionListInitializer">
			<!-- Expression is not needed since the HQL will be formed in Action classes -->
			<Expression></Expression>
		</List>
	</SearchParameters>
</SearchFormDefinition>